{
  "schema_version": "1.0.0",
  "artifact_id": "art_fix_plan_e5f6g7h8",
  "run_id": "run_20260810_001",
  "trace_id": "4bf92f3577b34da6a3ce929d0e0e4736",
  "parent_artifact_id": "art_review_report_a1b2c3d4",
  "producer": {
    "team": "investigate",
    "agent": "investigate-leader",
    "model": "gpt-4o"
  },
  "status": "passed",
  "started_at": "2026-08-10T08:05:00Z",
  "completed_at": "2026-08-10T08:12:30Z",
  "duration_ms": 450000,
  "input_refs": [
    {
      "ref_id": "IN_010",
      "type": "artifact",
      "uri": "artifacts/run_001/review-report.json",
      "description": "上游 T1 审查报告"
    },
    {
      "ref_id": "IN_011",
      "type": "codebase",
      "uri": "git://github.com/example/service-cache@main",
      "description": "缓存服务代码仓库"
    }
  ],
  "evidence_refs": [
    {
      "evidence_id": "EV_INV_001",
      "type": "log",
      "uri": "evidence/reproduction.log",
      "description": "复现数据竞争的 race detector 输出",
      "sha256": "e3b0c44298fc1c149afbf4c8996fb92427ae41e4649b934ca495991b7852b855"
    }
  ],
  "validation": {
    "schema": "fix-plan.schema.json",
    "valid": true,
    "errors": []
  },
  "next_action": {
    "target": "fix",
    "reason_code": "ROOT_CAUSE_CONFIRMED",
    "reason": "根因确认为 map 并发写缺少互斥锁，已选定修复方案，移交 T3 修复 Team"
  },
  "payload": {
    "target_defect_id": "DEF_CANON_001",
    "reproduction": {
      "environment": "Go 1.22, Linux amd64, 4 vCPU, race detector enabled",
      "preconditions": [
        "缓存已预热，包含 1 万条商品价格数据",
        "后台 Refresh goroutine 每 30s 触发一次全量刷新"
      ],
      "steps": [
        "启动 100 个 goroutine 并发调用 Store.Get()",
        "同时触发 Store.Refresh() 全量写入",
        "使用 go test -race -count=100 重复执行"
      ],
      "expected": "所有读取返回一致数据，无竞态警告",
      "actual": "race detector 在 store.go:87 报告 concurrent map writes，约 12% 运行触发竞态"
    },
    "hypotheses": [
      {
        "hypothesis_id": "H1",
        "perspective": "recent_change",
        "assertion": "近期重构将写锁从 Refresh 方法中移除或缩小了临界区",
        "supporting_evidence": [
          {
            "evidence_id": "EV_H1_S1",
            "type": "code",
            "uri": "git://github.com/example/service-cache@main",
            "location": { "start_line": 82, "end_line": 95 },
            "claim": "Store.set() 方法在 L87 直接对 map 赋值，无任何锁保护",
            "verification": {
              "method": "代码审查：检查 set() 调用链中所有锁获取点",
              "result": "confirmed"
            }
          }
        ],
        "counter_evidence": [
          "git blame 显示 set() 自 v2.5.0 起即无锁，非近期引入；但 v2.8.0 新增了后台 Refresh goroutine 后才暴露"
        ],
        "experiments": [
          {
            "description": "在 set() 中添加 sync.Mutex 后重新运行 race test",
            "outcome": "confirmed"
          }
        ],
        "result": "confirmed"
      },
      {
        "hypothesis_id": "H2",
        "perspective": "timing",
        "assertion": "sync.RWMutex 的读锁未正确覆盖 Refresh 期间的写路径",
        "supporting_evidence": [
          {
            "evidence_id": "EV_H2_S1",
            "type": "code",
            "uri": "git://github.com/example/service-cache@main",
            "location": { "start_line": 45, "end_line": 60 },
            "claim": "Get() 使用 RLock，Refresh() 在 L52 释放写锁后 L55 仍调用 set()——写操作落到了锁外",
            "verification": {
              "method": "代码审查：追踪 Refresh() 中 Lock/Unlock 区间覆盖的所有写操作",
              "result": "confirmed"
            }
          }
        ],
        "counter_evidence": [
          "即使修复 Refresh 锁区间，set() 自身无锁的问题仍然存在——H2 是部分原因，非根因"
        ],
        "experiments": [],
        "result": "confirmed"
      },
      {
        "hypothesis_id": "H3",
        "perspective": "data",
        "assertion": "缓存数据本身存在循环引用导致竞态，与锁无关",
        "supporting_evidence": [],
        "counter_evidence": [
          "race detector 定位精确指向 map 写入，非数据字段访问",
          "使用 sync.Map 替换后竞态消失，排除了数据结构的因素"
        ],
        "experiments": [],
        "result": "rejected"
      }
    ],
    "root_cause": {
      "conclusion": "Store.set() 方法对共享 map 的写入操作未受任何互斥锁保护，在后台 Refresh goroutine 与前台 Read goroutine 并发时产生 data race。Refresh() 的写锁区间存在缺陷（L55 set() 在 Unlock 之后调用），加剧了竞态窗口。",
      "causal_chain": [
        "v2.5.0: Store.set() 设计为仅在单 goroutine 的 Refresh 中调用，未加锁（当时安全）",
        "v2.8.0: 引入高性能 Read 路径，允许 Get() 与 Refresh() 并发执行",
        "Refresh() 的 sync.Mutex 在 L52 Unlock 后，L55 的 set() 调用暴露给并发的 Get()",
        "set() 本身无任何锁，直接对 map 赋值，违反 Go 并发安全规则"
      ],
      "evidence_refs": ["EV_H1_S1", "EV_H2_S1"],
      "confidence": "high",
      "unresolved_questions": []
    },
    "fix_candidates": [
      {
        "candidate_id": "FIX_001",
        "approach": "为 Store 增加 sync.RWMutex，set() 获取写锁，Get() 获取读锁",
        "target_files": ["internal/cache/store.go"],
        "expected_changes": [
          "Store 结构体新增 mu sync.RWMutex 字段",
          "set() 方法开头加 mu.Lock(); defer mu.Unlock()",
          "Get() 方法开头加 mu.RLock(); defer mu.RUnlock()",
          "简化 Refresh() 的锁逻辑，去掉局部的 sync.Mutex"
        ],
        "impact_scope": [
          "Store 的所有读写方法均受锁保护，读并发度不受影响（RWMutex 允许并行读）"
        ],
        "risks": [
          "若某调用方在持有读锁时尝试获取写锁，会死锁——需审计所有 Store 方法间的互调"
        ],
        "rollback_strategy": "回退 commit，恢复原 Refresh() 内的局部 sync.Mutex 并确保 set() 在锁区间内",
        "acceptance_criteria": [
          "go test -race -count=500 ./internal/cache/... 零竞态警告",
          "基准测试 QPS 下降不超过 5%（RWMutex 读路径开销）",
          "现有单元测试全部通过"
        ],
        "priority": "p0"
      },
      {
        "candidate_id": "FIX_002",
        "approach": "将 map 替换为 sync.Map，移除所有手动锁",
        "target_files": ["internal/cache/store.go"],
        "expected_changes": [
          "Store.items 类型从 map[string]Item 改为 sync.Map",
          "set() 改为 Store.items.Store(key, val)",
          "Get() 改为 Store.items.Load(key)"
        ],
        "impact_scope": [
          "sync.Map 对读多写少场景优化更好，但类型安全性下降（需 interface{} 断言）"
        ],
        "risks": [
          "sync.Map 的 Range 性能在大量 key 下不如原生 map + RLock",
          "需要修改所有遍历 items 的代码（如 Refresh 中的全量更新逻辑）"
        ],
        "rollback_strategy": "回退 commit，恢复原生 map + RWMutex 方案",
        "acceptance_criteria": [
          "go test -race -count=500 ./internal/cache/... 零竞态警告",
          "现有所有测试通过",
          "Refresh 全量更新逻辑验证正确"
        ],
        "priority": "p1"
      }
    ],
    "selected_candidate_id": "FIX_001"
  }
}
